ボーイ	ボーイ ボーイ boy; bellboy; porter; waiter
表す	表す あらわす to represent; to signify; to stand for; to reveal; to show; to display; to express; to make widely known
最中	最中 さいちゅう in the middle of; height of; in course of; midst
ところが	ところが ところが even so; however; still; whereupon; even though; nevertheless; on the contrary; as a matter of fact; despite
ゴール	ゴール ゴール goal; basket (basketball); finishing line; winning post; Gaul
経つ	経つ たつ to pass; to lapse
さて	さて さて well; now; then
きちんと	きちんと きちんと precisely; accurately; neatly
哀れ	哀れ あわれ pity; sorrow; grief; misery; compassion; pathos; pitiable; pitiful; pathetic; miserable; alack; alas
それでも	それでも それでも but (still); and yet; nevertheless; even so; notwithstanding
田	田 た rice field
横切る	横切る よこぎる to cross (e.g. road); to traverse
得る	得る える to get; to earn; to acquire; to procure; to gain; to secure; to attain; to obtain; to win; to understand; to comprehend; to receive something undesirable (e.g. a punishment); to get (ill); to be able to ..., can ...
辞める	辞める やめる to resign; to retire; to quit; to leave (one's job, etc.)
はさみ	はさみ はさみ scissors; shears; clippers; hole punch
求める	求める もとめる to want; to wish for; to request; to demand; to seek; to search for; to pursue (pleasure); to hunt (a job); to purchase; to buy
キャプテン	キャプテン キャプテン captain
まさか	まさか まさか by no means; never!; well, I never!; you don't say!; certainly (not); something unexpected; emergency; currently; for the time being; presently; for now; indeed; really; truly; unexpectedly
すなわち	すなわち すなわち that is; namely; i.e.
真似	真似 まね imitating; copying; mimicry; behavior; behaviour; action; conduct
まるで	まるで まるで quite; entirely; completely; at all; as if; as though; just like
ごめんなさい	ごめんなさい ごめんなさい I'm sorry; I beg your pardon; excuse me
ジュース	ジュース ジュース juice; soft drink (any (sweet) non-alcoholic beverage, carbonated or uncarbonated); deuce
ロケット	ロケット ロケット locket; rocket
適する	適する てきする to fit; to suit
積もる	積もる つもる to pile up; to accumulate; to estimate
喧嘩	喧嘩 けんか quarrel; brawl; fight; squabble; scuffle; argument
パスポート	パスポート パスポート passport
訳	訳 やく translation; version (e.g. "English version")
立ち上がる	立ち上がる たちあがる to stand up; to get up; to rise; to recover; to take action; to start; to make the initial charge; to start up; to boot up
凍る	凍る こおる to freeze; to be frozen over; to congeal
頬	頬 ほお cheek (of face)
現れる	現れる あらわれる to appear; to come in sight; to become visible; to come out; to embody; to materialize; to materialise; to be expressed (e.g. emotions); to become apparent (e.g. trends, effects)
いらっしゃい	いらっしゃい いらっしゃい come; go; stay; welcome!
のんびり	のんびり のんびり carefree; at leisure
馬鹿	馬鹿 ばか idiot; moron; fool; trivial matter; folly; absurdity; stupid; foolish; dull; absurd; ridiculous; fervent enthusiast; nut; person singularly obsessed with something; Mactra chinensis (species of trough shell)
贅沢	贅沢 ぜいたく luxury; extravagance; to live in luxury
付ける	付ける つける to attach; to join; to add; to append; to affix; to stick; to glue; to fasten; to sew on; to apply (ointment); to furnish (a house with); to wear; to put on; to keep a diary; to make an entry; to appraise; to set (a price); to allot; to budget; to assign; to bring alongside; to place (under guard or doctor); to follow; to shadow; to load; to give (courage to); to keep (an eye on); to establish (relations or understanding); to turn on (light); to produce flowers; to produce fruit
かもしれない	かもしれない かもしれない may; might; perhaps; may be; possibly
振る	振る ふる to wave; to shake; to swing; to sprinkle; to throw (dice); to cast (actor); to allocate (work); to turn down (somebody); to reject; to jilt; to dump; to abandon; to give up; to ruin; to add kana indicating a reading of a word; to slightly change headings; to change directions; to extract by broiling; to prepare an infusion of; to decoct; to carry with great vigor (e.g. a portable shrine); to bring up a topic; to lead to a topic; to replace; to substitute; to set up a joke for somebody else
できれば	できれば できれば if possible
器用	器用 きよう nimble-fingered; dexterous; dextrous; skillful (with the fingers); skilful; handy; clever; shrewd; ingenious
指す	指す さす to point; to nominate; to select someone; to specify some person; to identify; to indicate; to point out; to play; to extend one's arm straight ahead (in dance)
お腹	お腹 おなか stomach
停留所	停留所 ていりゅうじょ bus stop; tram stop; stop; station
訴える	訴える うったえる to raise; to bring to (someone's attention); to appeal to (reason, emotions, etc.); to work on (one's emotions); to play on (one's sympathies); to complain; to sue (a person); to take someone to court; to resort to (e.g. arms, violence)
極	極 きょく pole; climax; extreme; extremity; culmination; height; zenith; nadir
貰う	貰う もらう to receive; to take; to accept; to get somebody to do something
流れる	流れる ながれる to stream; to flow (liquid, time, etc.); to run (ink); to be washed away; to be carried; to drift; to float (e.g. clouds); to wander; to stray; to sweep (e.g. rumour, fire); to spread; to circulate; to be heard (e.g. music); to be played; to lapse (e.g. into indolence, despair); to pass; to elapse; to be transmitted; to be called off; to be forfeited; to disappear; to be removed
とんでもない	とんでもない とんでもない unthinkable; unexpected; outrageous; offensive; terrible; absolutely not!; not at all!; far from it!; impossible!; preposterous!; what a thing to say!; no way!; bullshit; don't mention it; you're welcome
ちょうだい	ちょうだい ちょうだい receiving; reception; getting; being given; eating; drinking; having; please; please do for me
取り上げる	取り上げる とりあげる to pick up; to take up; to adopt; to feature; to accept; to listen to; to take away; to confiscate; to deprive; to disqualify; to deliver (a child)
おしゃべり	おしゃべり おしゃべり chattering; talk; idle talk; chat; chitchat; gossip; chatty; talkative; chatterbox; blabbermouth
たまらない	たまらない たまらない intolerable; unbearable; unendurable; irresistible; tremendous; out of this world; cannot help (doing); cannot but do; anxious to do
上等	上等 じょうとう superiority; first-class; very good; (that's) just fine!; bring it on!
いたずら	いたずら いたずら mischief; prank; trick; practical joke; pastime; hobby; playing with (a lighter, etc.); fooling around with; messing around with; amusing oneself with; tampering with; lewd behaviour; sexual misconduct; sexual assault; molestation; rape
デモ	デモ デモ demonstration; protest
等しい	等しい ひとしい equal; similar; like; equivalent
届く	届く とどく to reach; to arrive; to get through; to get at; to be attentive; to pay attention; to be delivered; to carry (e.g. sound)
描く	描く えがく to draw; to paint; to sketch; to depict; to describe; to picture in one's mind; to imagine; to form a certain shape (e.g. path of an action, appearance of an object, etc.)
支える	支える ささえる to support; to prop; to sustain; to underlay; to hold up; to hold at bay; to stem; to check
覚める	覚める さめる to wake; to wake up; to become sober; to sober up; to regain consciousness (e.g. after anaesthesia); to come to one's senses; to be disillusioned
それとも	それとも それとも or; or else
トランプ	トランプ トランプ playing cards
ウイスキー	ウイスキー ウイスキー whisky; whiskey
腐る	腐る くさる to rot; to go bad; to decay; to spoil; to fester; to decompose; to turn sour (e.g. milk); to corrode; to weather; to crumble; to become useless; to blunt; to weaken (from lack of practice); to become depraved; to be degenerate; to be morally bankrupt; to be corrupt; to be depressed; to be dispirited; to feel discouraged; to feel down; indicates scorn or disdain for another's action; to lose a bet; to be drenched; to become sopping wet
象	象 ぞう elephant (Elephantidae spp.)
気に入る	気に入る きにいる to be pleased with; to suit
幾ら	幾ら いくら how much?; how many?; even; even if
退屈	退屈 たいくつ tedium; boredom
伸ばす	伸ばす のばす to grow long (e.g. hair, nails); to lengthen; to extend; to stretch; to reach out; to hold out; to straighten; to smooth out; to spread evenly (dough, cream, etc.); to dilute; to thin out; to postpone; to prolong; to strengthen; to develop; to expand
わざと	わざと わざと on purpose
そのうち	そのうち そのうち before very long; soon; eventually; sooner or later; of the previously mentioned
そっと	そっと そっと softly; gently; quietly; secretly
ヨット	ヨット ヨット yacht (usually only used for a sailing boat with one mast)
掛かる	掛かる かかる to take (a resource, e.g. time or money); to hang; to come into view; to arrive; to come under (a contract, a tax); to start (engines, motors); to attend; to deal with; to handle; to have started to; to be on the verge of; to overlap (e.g. information in a manual); to cover; to (come) at; to be fastened; to be covered (e.g. with dust, a table-cloth, etc.); to be caught in; to get a call; to depend on; to fall for (a trick)
利口	利口 りこう clever; intelligent; wise; bright; sharp; sensible; smart; shrewd; well-behaved (of kids, animals, etc); obedient; good; good (with words)
さっぱり	さっぱり さっぱり feeling refreshed; feeling relieved; neat; trimmed; plain; simple; completely; entirely; not in the least (in sentence with negative verb); not at all; completely ignorant; not doing at all
現す	現す あらわす to represent; to signify; to stand for; to reveal; to show; to display; to express; to make widely known
稼ぐ	稼ぐ かせぐ to earn income; to labor; to labour
取れる	取れる とれる to come off; to be removed; (of pain, a fever, etc.) to disappear; to be caught; to be harvested; to be interpreted (as); to be taken as; (of balance, etc.) to be attained; to be obtainable
戦う	戦う たたかう to make war (on); to wage war (against); to go to war (with); to fight (with); to do battle (against); to compete (against); to struggle (against adversities, etc.); to fight; to contend; to resist
アイスクリーム	アイスクリーム アイスクリーム ice cream; icecream
通じる	通じる つうじる to be open (to traffic); to lead to; to communicate (with); to flow (liquid, current); to pass; to get through to; to be understood; to be comprehended; to be honored; to be good; to be well versed in; to be well-informed; to communicate clandestinely; to keep in touch (e.g. with the enemy); to form a liaison; to be intimate; to spread widely; to disseminate
そっくり	そっくり そっくり all; altogether; entirely; completely; exactly like; just like
額	額 ひたい forehead; brow
ピクニック	ピクニック ピクニック picnic
男の人	男の人 おとこのひと man
やがて	やがて やがて before long; soon; almost; nearly; finally; in the end; eventually
余分	余分 よぶん extra; excess; surplus
急に	急に きゅうに swiftly; rapidly; suddenly; abruptly; immediately
どんなに	どんなに どんなに how; how much
トンネル	トンネル トンネル tunnel; to tunnel (through a potential barrier); letting a grounder go through one's legs
密	密 みつ density; thickness; secrecy; minute; fine; esoteric Buddhism; secret Buddhist teachings
あちこち	あちこち あちこち here and there; all around; everywhere; throughout; all over; to get things in the wrong order (back to front); to become muddled up
羽	羽 はね feather; plume; wing; blade (fan, propeller, etc.)
ふと	ふと ふと suddenly; casually; accidentally; incidentally; unexpectedly; unintentionally
バイオリン	バイオリン バイオリン violin
もしも	もしも もしも if
あんなに	あんなに あんなに to that extent; to that degree